{
    "name": "japansh",
    "type": "external",
    "namespace": "http://id.ndl.go.jp/auth/ndlsh/",
    "matches": ["id.ndl.go.jp/auth/ndlsh/"],
    "wikidata_property": ["P349"],
    "merge_order": 24,
    "mapSizeExponent": null,
    "fetch": "http://id.ndl.go.jp/auth/ndlsh/{identifier}.json",
    "activitystreams": null,
    
    "harvesterClass": "",
    "fetcherClass": "sources.libraries.japan.fetcher.JapanShFetcher",
    "loaderClass": "",
    "indexLoaderClass": "",
    "mapperClass": "sources.libraries.japan.mapper.JapanShMapper",
    "reconcilerClass": "",

    "cycleBreakPath": "",
    "dumpFilePath": "",
    "remoteDumpFile": "",
    "externalLinksPath": "",
    "reconcileDumpPath": "",
    "reconcileDbPath": "",
    "inverseEquivDbPath": "",


    "dump_file_subdir": "",
    "remote_dump_files": [
        ""
    ]

}
