{
    "name": "dnb",
    "type": "external",
    "namespace": "https://d-nb.info/gnd/",
    "matches": ["d-nb.info/gnd/", "hub.culturegraph.org/entityfacts/", 
		"d-nb.info/standards/vocab/gnd/"],
    "wikidata_property": ["P227"],
    "merge_order": 21,
    "mapSizeExponent": null,
    "fetch": "https://hub.culturegraph.org/entityfacts/{identifier}",
    "activitystreams": null,
    
    "harvesterClass": "",
    "fetcherClass": "sources.libraries.dnb.fetcher.DnbFetcher",
    "loaderClass": "sources.libraries.dnb.loader.DnbLoader",
    "indexLoaderClass": "",
    "mapperClass": "sources.libraries.dnb.mapper.DnbMapper",
    "reconcilerClass": "",

    "cycleBreakPath": "dnb_cycle_breaks.json",
    "dumpFilePath": "dnb/authorities-gnd_entityfacts.jsonld.gz",
    "remoteDumpFile": "https://data.dnb.de/opendata/authorities_entityfacts.jsonld.gz",
    "externalLinksPath": "",
    "reconcileDumpPath": "",
    "reconcileDbPath": "",
    "inverseEquivDbPath": "",

    "dump_file_subdir": "dnb",
    "remote_dump_files": [
        "https://data.dnb.de/opendata/authorities-gnd-sachbegriff_lds.jsonld.gz",
        "https://data.dnb.de/opendata/authorities-gnd_entityfacts.jsonld.gz",
        "https://data.dnb.de/opendata/mapping-authorities-gnd-lcsh-ram_lds.jsonld.gz"
    ]
}
