{
    "name": "lcsh",
    "type": "external",
    "namespace": "http://id.loc.gov/authorities/subjects/",
    "matches": ["id.loc.gov/authorities/subjects/"],
    "wikidata_property": ["P244"],
    "merge_order": 14,
    "mapSizeExponent": null,
    "fetch": "http://id.loc.gov/authorities/subjects/{identifier}.json",
    "activitystreams": [
        "https://id.loc.gov/authorities/subjects/activitystreams/feed"
    ],

    "harvesterClass": "",
    "fetcherClass": "sources.authorities.lc.fetcher.LcshFetcher",
    "loaderClass": "sources.authorities.lc.loader.LcLoader",
    "indexLoaderClass": "sources.authorities.lc.index_loader.LCIndexLoader",
    "mapperClass": "sources.authorities.lc.mapper.LcshMapper",
    "reconcilerClass": "sources.authorities.lc.reconciler.LcshReconciler",

    "cycleBreakPath": "lcsh_cycle_breaks.json",
    "dumpFilePath": "lcsh/subjects.madsrdf.jsonld.gz",
    "remoteDumpFile": "",
    "externalLinksPath": "lcsh/external_links.nt",
    "reconcileDumpPath": "",
    "reconcileDbPath": "label_to_lcsh.lmdb",
    "inverseEquivDbPath": "id_to_lcsh.lmdb",

    "dump_file_subdir": "lcsh",
    "remote_dump_files": [
        "https://lds-downloads.s3.amazonaws.com/authorities/subjects.madsrdf.jsonld.gz"
    ]
}
