{
    "name": "geonames",
    "type": "external",
    "namespace": "https://sws.geonames.org/",
    "matches": ["geonames.org/"],
    "wikidata_property": ["P1566"],
    "merge_order": 41,
    "mapSizeExponent": null,
    "fetch": "https://sws.geonames.org/{identifier}/about.rdf",    
    "activitystreams": null,
    
    "harvesterClass": "",
    "fetcherClass": "sources.general.geonames.fetcher.GnFetcher",
    "loaderClass": "sources.general.geonames.loader.GnLoader",
    "indexLoaderClass": "",
    "mapperClass": "sources.general.geonames.mapper.GnMapper",
    "reconcilerClass": "",

    "cycleBreakPath": "geonames_cycle_breaks.json",
    "dumpFilePath": "",
    "remoteDumpFile": "",
    "externalLinksPath": "",
    "reconcileDumpPath": "",
    "reconcileDbPath": "",
    "inverseEquivDbPath": "",

    "dump_file_subdir": "geonames",
    "remote_dump_files": [
        "https://download.geonames.org/export/dump/allCountries.zip", 
        "https://download.geonames.org/export/dump/alternateNamesV2.zip",
        "https://download.geonames.org/export/dump/hierarchy.zip"
    ]
}
