{
    "name": "aat",
    "type": "external",
    "namespace": "http://vocab.getty.edu/aat/",
    "matches": ["vocab.getty.edu/aat/"],
    "wikidata_property": ["P1014"],
    "merge_order": 10,
    "mapSizeExponent": null,
    "fetch": "https://vocab.getty.edu/aat/{identifier}.jsonld",
    "activitystreams": ["https://data.getty.edu/vocab/activity-stream"],
    
    "harvesterClass": "sources.authorities.getty.harvester.GettyHarvester",
    "fetcherClass": "",
    "loaderClass": "",
    "indexLoaderClass": "process.base.index_loader.LmdbIndexLoader",
    "mapperClass": "sources.authorities.getty.mapper.AatMapper",
    "reconcilerClass": "sources.authorities.getty.reconciler.AatReconciler",
    
    
    "cycleBreakPath": "aat_cycle_breaks.json",
    "dumpFilePath": "",
    "remoteDumpFile": "",
    "externalLinksPath": "",
    "reconcileDumpPath": "",
    "reconcileDbPath": "label_to_aat.lmdb",
    "inverseEquivDbPath": "",

    "dump_file_subdir": "",
    "remote_dump_files": [
        ""
    ]

    
}
